{
  "event_version": 1,
  "event_id": "A01-REPAIR-a01-run-34431764843-A01-CONTROL-PLANE-SELFTEST-A1-E0003",
  "transaction_id": "A01-REPAIR-a01-run-34431764843-A01-CONTROL-PLANE-SELFTEST-A1",
  "event_type": "CANDIDATE_PREQUALIFIED",
  "recorded_at": "2026-09-10T09:12:00.000Z",
  "owner_path": "SYSTEM_MASTER/CORE",
  "receipt_id": "a01-run-34431764843-A01-CONTROL-PLANE-SELFTEST",
  "qualification_id": "A01-CONTROL-PLANE-SELFTEST",
  "workstream_id": "SYSTEM-MASTER",
  "failed_subject_sha": "3a8004813e18d7defbf1f9ebc47f5bd8fcd30fb9",
  "replacement_subject_sha": "ceb6870546012b789caea56499a1d219a195dc8b",
  "state": "A01_REQUEUE_READY",
  "classification": "REPAIRABLE_SUBJECT",
  "repair_attempt": 0,
  "evidence_pointer": "artifact:A01-CONTROL-PLANE-SELFTEST-34431764843-evidence",
  "prequalification_evidence_pointer": "github-actions-run:34435547400:A-01-Control-Plane-Enforcement:PASS:subject:ceb6870546012b789caea56499a1d219a195dc8b",
  "replacement_ticket_pointer": null,
  "a01_rerun_receipt_pointer": null,
  "payload": {
    "repair_branch": "refs/heads/main",
    "root_failed_subject_sha": "3a8004813e18d7defbf1f9ebc47f5bd8fcd30fb9",
    "repair_base_subject_sha": "3a8004813e18d7defbf1f9ebc47f5bd8fcd30fb9",
    "replacement_subject_sha": "ceb6870546012b789caea56499a1d219a195dc8b",
    "candidate_repair_attempt": 1,
    "prequalification_evidence_pointer": "github-actions-run:34435547400:A-01-Control-Plane-Enforcement:PASS:subject:ceb6870546012b789caea56499a1d219a195dc8b"
  }
}
