{
  "event_version": 1,
  "event_id": "A01-REPAIR-a01-run-34431764843-A01-CONTROL-PLANE-SELFTEST-A1-E0006",
  "transaction_id": "A01-REPAIR-a01-run-34431764843-A01-CONTROL-PLANE-SELFTEST-A1",
  "event_type": "TRANSACTION_DEAD_LETTERED",
  "recorded_at": "2026-09-11T11:49:24.890Z",
  "owner_path": "SYSTEM_MASTER/CORE",
  "receipt_id": "a01-run-34431764843-A01-CONTROL-PLANE-SELFTEST",
  "qualification_id": "A01-CONTROL-PLANE-SELFTEST",
  "workstream_id": "SYSTEM-MASTER",
  "failed_subject_sha": "3a8004813e18d7defbf1f9ebc47f5bd8fcd30fb9",
  "replacement_subject_sha": null,
  "state": "DEAD_LETTER",
  "classification": "REPAIRABLE_SUBJECT",
  "repair_attempt": 1,
  "evidence_pointer": "artifact:A01-CONTROL-PLANE-SELFTEST-34431764843-evidence",
  "prequalification_evidence_pointer": null,
  "replacement_ticket_pointer": null,
  "a01_rerun_receipt_pointer": "github-actions-run:34595673549:artifact:A01-CONTROL-PLANE-SELFTEST-34595673549-evidence",
  "payload": {
    "reason": "REPAIR_BUDGET_EXHAUSTED",
    "rerun_receipt_event": "governance/repair/events/A01-REPAIR-a01-run-34431764843-A01-CONTROL-PLANE-SELFTEST-A1/0005-a01_rerun_receipt_recorded.json",
    "latest_failed_subject_sha": "ceb6870546012b789caea56499a1d219a195dc8b"
  }
}
